{
  "schema_version": "ao.command.production-readiness-audit.v0.1",
  "status": "passed",
  "readiness_percent": 100,
  "passed_gates": 36,
  "total_gates": 36,
  "failed_checks": 0,
  "checks": [
    {"check_id":"clean_worktree","status":"passed","summary":"working tree is clean"},
    {"check_id":"repository_public","status":"passed","summary":"uesugitorachiyo/ao-command is public and deletes merged branches"},
    {"check_id":"branch_protection","status":"passed","summary":"main requires strict License policy, Go, Workflow lint, and Production readiness audit checks and denies force-push/delete"},
    {"check_id":"secret_scanning","status":"passed","summary":"secret scanning and push protection are enabled"},
    {"check_id":"vulnerability_alerts","status":"passed","summary":"vulnerability alerts are enabled"},
    {"check_id":"secret_patterns","status":"passed","summary":"tracked files contain no obvious tokens, private keys, or provider secrets"},
    {"check_id":"machine_local_paths","status":"passed","summary":"tracked files contain no user home absolute paths"},
    {"check_id":"ci_artifact_uploads","status":"passed","summary":"workflows and scripts do not upload CI artifacts by default"},
    {"check_id":"dangerous_write_surface","status":"passed","summary":"command surface has no public-switch, release-publish, production-promotion, or destructive git operations"},
    {"check_id":"readiness_docs","status":"passed","summary":"README and SECURITY document production/public readiness"},
    {"check_id":"ci_readiness_job","status":"passed","summary":"CI defines a production readiness audit job and manual dispatch"},
    {"check_id":"readiness_contract","status":"passed","summary":"production readiness audit has a schema contract validated in CI"},
    {"check_id":"release_preview_contract","status":"passed","summary":"release preview dry-run contract is present and wired into CI"},
    {"check_id":"install_verify_contract","status":"passed","summary":"install verification dry-run contract is present and wired into CI"},
    {"check_id":"release_governance_contract","status":"passed","summary":"release governance dry-run contract is present and wired into CI"},
    {"check_id":"rsi_health_contract","status":"passed","summary":"RSI health, bundle, and claim manifest checks are present and wired into CI"},
    {"check_id":"retained_evidence_policy","status":"passed","summary":"public-safe retained evidence policy and manifest are present"},
    {"check_id":"operator_closeout","status":"passed","summary":"v0.1.0 operator closeout documents ready scope, evidence, and remaining actions"},
    {"check_id":"go_test","status":"passed","summary":"Go tests pass"},
    {"check_id":"go_vet","status":"passed","summary":"go vet passes"},
    {"check_id":"go_build","status":"passed","summary":"ao-command builds"},
    {"check_id":"workflow_lint","status":"passed","summary":"GitHub workflow lint passes"},
    {"check_id":"integration_smoke","status":"passed","summary":"AO Forge-backed ao-command smoke passes"},
    {"check_id":"release_preview_dry_run","status":"passed","summary":"AO Command release preview dry-run passes"},
    {"check_id":"release_preview_contract_validate","status":"passed","summary":"AO Command release preview audit validates against its schema"},
    {"check_id":"install_verify_dry_run","status":"passed","summary":"AO Command install verification dry-run passes"},
    {"check_id":"install_verify_contract_validate","status":"passed","summary":"AO Command install verification audit validates against its schema"},
    {"check_id":"release_governance_dry_run","status":"passed","summary":"AO Command release governance dry-run passes"},
    {"check_id":"release_governance_contract_validate","status":"passed","summary":"AO Command release governance audit validates against its schema"},
    {"check_id":"active_stack_status","status":"passed","summary":"AO Command reads AO Foundry active-stack handoff status without orchestration"},
    {"check_id":"atlas_status_readback","status":"passed","summary":"AO Command reads AO Foundry Atlas status without scheduling or execution"},
    {"check_id":"rsi_evidence_chain_smoke","status":"passed","summary":"Foundry pulse, Forge retained proofs, Command health, and Covenant RSI claim boundary pass"},
    {"check_id":"rsi_claim_manifest","status":"passed","summary":"AO Command validates AO Architecture RSI claim manifest without mutation"},
    {"check_id":"rsi_health_contract_validate","status":"passed","summary":"AO Command RSI health JSON validates against its schema"},
    {"check_id":"rsi_health_bundle_contract_validate","status":"passed","summary":"AO Command RSI health bundle validates against its schema"},
    {"check_id":"ao_forge_readiness","status":"passed","summary":"AO Forge production readiness is 100 percent"}
  ]
}
